{
  "schema_version": "1.0",
  "channel_id": "local-template",
  "display_name": "本机渠道模板（复制到 $MANJU_HOME/channels，不要提交真实渠道）",
  "provider_kind": "local",
  "notes": "字段模板。真实渠道/反代/密钥只放本机 $MANJU_HOME/channels/，禁止推 GitHub。",
  "created_at": "2026-10-18T00:00:00+08:00",
  "updated_at": "2026-10-18T00:00:00+08:00",
  "models": {
    "minimax-h3": {
      "model_id_on_channel": "h3-base",
      "capabilities": {
        "duration_seconds": {
          "value": { "min": 4, "max": 10, "integer_only": false },
          "status": "declared",
          "ttl_days": 30
        },
        "aspect_ratios": { "value": ["16:9"], "status": "declared", "ttl_days": 90 },
        "modes": { "value": ["T2VA", "I2VA", "Ref2VA"], "status": "declared", "ttl_days": 30 },
        "reference_inputs": {
          "value": { "image": 2, "video": 0, "audio": 0, "total": 2 },
          "status": "declared",
          "ttl_days": 30
        },
        "frame_anchors": { "value": { "first": true, "last": false }, "status": "declared", "ttl_days": 30 },
        "audio_output": { "value": "unknown", "status": "declared", "ttl_days": 60 },
        "reference_audio": { "value": "unknown", "status": "declared", "ttl_days": 60 },
        "reference_transport": { "value": "unknown", "status": "declared", "ttl_days": 60 },
        "image_pricing": { "value": "unknown", "status": "declared", "ttl_days": 90 }
      }
    }
  }
}
